name,review
시민덕희,"['실화 바탕으로 여성 주연들이 활약하는 여성감독 영화라는 점에서 의미는 있다. 그러나 캐릭터들을 이토록 작위적으로 구성할 수가 있나?', '실화를 모티브로 하였지만\n실화는 아닌 이야기.\n실화를 그대로 다뤘다면\n오히려 욕먹었을 이야기를\n적절하게 영화화하였다.\n무엇보다 K-아줌마와 같은\n끔찍한 혼종은 없어서 좋았다.', '생각보다 더 코믹해서 재밌었고, 통쾌한 추격극이었다!!', '보는 내내 실화라는게 놀라운 영화!!!', '치고 빠지는 방법을 막 배웠지만 예측 하기 쉬운 주먹은 여전.', '너무 예상했던 대로 그대로를 보여주기에 아쉽다.', '배우들의 빛나는 연기력이 없었다면 다소 유치했을뻔.\n<보이스>가 형사의 입장이었다면  <시민덕희>는 피해자의 마음을 담았다.', '실화에 한국식 코메디와 장르 과정성을 끼얹다', '실화를 바탕으로 한 만큼, 어쩌면 서민이 할 수 있는 한도 내에서만 움직인 점이 <보이스>와의 차별화가 될듯', '믿고 보는 배우들의 장르 불문 활약 기다려집니다 🙌🙌', '실화 못지않게 울림과 희망을 차곡차곡 쌓아가는 추적극', '실제 인물 덕희님께 무한 리스펙을 날립니다👍👍', '가벼운 맘으로 갔다가 꿀잼이라 깜놀!? 실화 바탕 영화는 자칫 잘못하면 다큐 같아서 흥미가 떨어질 때도 있는가 하면, 사실성의 힘을 초석으로 흥미가 배가 되기도 한다. 이건 후자!', '실화의 힘을 조금만 더 믿었더라면', '.', '절박해진 사람이 경쾌함을 찾기까지', '정의구현 앞에 더이상 시민은 기다리고만 있지 않는다.', '돈만이 가져다주는 삶의 애환을 희화화하지 않으려 부단히 노력했다.', '[시민덕희] 짧은 관람 후기', '각색이 많아 영화로 볼 수 있는 이야기지만, 이것을 계기로 실화가 더 많이 알려질 수 있다면 성공 아닐까? 분량은 적지만 임팩트가 확실한 이무생도 색다르게 봤다.', '내 일을 나보다 더 절박하게 매달려줄 사람은 없다. 절박한 모습이 사람들을 움직이게 하는 것이다', '억지 추적극보다는 실화가 주는 메시지에 집중했더라면', '담백하게 표현하지 못한 아쉬움은 있지만 통쾌한 한방은 보장된다', '숟가락 하나만 얹은 경찰의 무능함', '통쾌함으로 둔갑한 저급 웃음과 유치함을 내세운\n흔하디흔한 영화와 달리 실화와 사건 중심의 이야기로 뚝심 있게 전개한다.', '아줌마의 일망타진, 아줌마의 정의구현.', '김미영팀장의 후예듵을 멸절시킬 그날까지', '시민덕희', '만화같은 실화를 어떻게 풀어냈을까 궁금했는데 과하게 만들지 않아서 좋았다. 손대리에게 이입할 수 있는가가 중요한 데 그 역할에 공명 캐스팅 한 게 신의한수. 울망울망🥹', '사건을 현실적으로 그리면서 적절한 코미디로 웃음 짓게 한다.', '<시민덕희>를 보고 💵', '관객의 몰입도와 재미는 배우의 연기력이 아니었다면 불가능했을 영화. 다만 실화라는 사실을 알게되면 너그러워진다.\np.s.다큐는 아니니 서울의 봄 처럼 과감한 극화를 해도 좋았을 듯', '수사물에 경찰만 병풍인, 보이스 피싱이라는 살을 에는 아픔을 웃기고 울리는 한국만의 영화로 되살려내다.', '꼭꼭 숨어봐! 시민덕희가 찾아간다. 무거운 범죄를 진지하게 다루면서도 유쾌함을 잃지 않았다.', '라미란이 나오면 믿고 봐도 된다.\n(시사회 24.1.18)', '깔끔하고 거의 모든 면에서 적당하다.\n비슷한 이야기들 많지만 실화 기반이란 점이 뒤를 받쳐준다', '뻔하지만 겁나 재밌다!\n(뻔해서 더 좋아. 실화니까.. 같은 해에 500만원 보이스피싱당했던 나... 나는 돈 못 찾았지만 겁나 속시원하네)', '보이스 피싱의 피해자 실화를 무겁지 않게\n가벼우면서도 피해자들의 답답한 현실감을\n차분하게 코믹을 곁들여 잘 보여주었다.\n\n과하지도 않고 부족하지도 않고 딱 무난하게 만들었다', '.', '시민덕희 시사회 후기 정보 출연진 무대인사 줄거리 결말 쿠키 유쾌한 일망타진극 한국영화 추천', '판을 깔아주면 확실하게 몫을 해내는 믿음직한 앙상블', '킬링타임용으로 가볍게 볼 수 있는 영화!! 실화 기반으로 만들어진 영화지만 마냥 무겁지 않고 유쾌하게 풀어내서 재밌었음!', '방금 영화봤어요\n별 기대 안했는데 너무 재밌게 봤어요\n영화 흥행하세요^^', '너무나 아쉬운 영화', '예고편을 보며 기대를 너무 해서 그런지 실망이 컸다. 보이스피싱이라는 범죄를 주제로 만든 작품이지만 웃음 요발 포인트도 있어서 그냥 무난하게 보기 좋았다.', '나는 진짜 재밌게 보고왔음 \n누구한테나 일어날수 있는일이라서 더 몰입되었던 것 같다 \n배우들이 연기를 너무 잘해서 불편함 없이 볼수있는영화.', '키노 시사회로 보고 왔습니다. 실화 기반이며 심장 쫄리는 부분이 좀 있고 잔인한 부분이 생각보다 많아요. 개그도 있고 눈물도 있고 킬링타임용으로 괜찮습니다', '시사회로 보고왔습니다! 배우분들 모두 연기는 말할 것 없는 명품연기! 긴장감 , 재미 , 통쾌함 모두 느낄 수 있어 시간가는 줄 모르고 너무너무 재밌게봤습니다!!', '그냥저냥 볼만 했어요 \n통쾌한 부분이 없어서 아쉽지만 😂 \n신파도 좀 있고 경찰? 형사 ? 좀 그렇고', '웃음 눈물 감동 재미 사회비판 다 잡은 흥미롭고 따뜻한 영화. 배경이 된 실제 사건을 알고 봤는데도 영화적 각색에 충분히 몰입할 수 있었다.', '완전 시원하면서도\n통쾌상쾌 짜릿했던\n보이스피싱에 대해\n명쾌한 답을 알려준\n정말 좋은영화였습니다', '배우분들 다 연기를 잘하시고 내용도 탄탄했어요. 영화 제목이 딱! 찰떡인 것 같아요!', '영화가 전하려는 메시지가 잘 느껴져서 좋았다\n그 메시지가 피해자들에게 전해졌길 그리고 그들이 위로받았길 바란다', '개봉전주 무대인사로 본 영화 실화를 바탕으로 한 가운데 나름의 재미도 있었고 배우들의 연기도 괜찮게 나왔다', '재밌는데 끝나고 나서 한번더 보고싶다?라는 생각은 안듬..내용을 알고있어서 또보면 임팩트가 .. 그래도 내용은 엄청 재밌어요!! 대사 욕 ㅋㅋㅋㅋ', '긴장감이 계속 유지되고 평범한 시민 덕희에게 공감이 잘 됩니다. 평범함 속에 살아있는 절실함과 선함이 결국 승리한다는 것을 보여주어서 좋았습니다.', '킬링타임용으로 괜찮게 빠진 영화', '답답한 현실에 영화라도 통쾌하게', '간만에 너무너무 재미없는 영화 끝까지보느라 힘들었음.. 댓글발바에 속아서 봄 ㅜㅜ', '흥미로운 모티브로 이도저도 아니게.', '재밌어요', '실화를 모티브로 해서 몰입이 잘되었습니다~ 경찰의 무능함과 답답함 때문에 홧병날뻔!', '한국 아줌마 폼 미쳤다!', '시사회 당첨으로 본 작품인데도 킬링 타임용으로 좋은 영화인 거 같습니다!! 보이스피싱을 다룬 작품이라 두근두근 떨려 하며 보는 재미도 있고, 배우분들이 연기를 다 잘하셔서 굿굿', '시사회 참여하여 봤는데 기대 이상으로 정말 재밌었어요 특히 라미란 배우님 연기가 와…. 대상 받으셔아할듯.. 최고의 연기였고 넘 재밋게 잘봤습니다!', '실화바탕이라서 그런지 더 재밌게봤던작품!!!', '용감한 제보자와 행동하는 시민의 사기단 추적스릴러. 실화라 더 깊이있는 연출이 아니었나 싶다.', '그냥 평범한 오락영화', '웃음도 있고,  아직 세상에는 이런 사람도 이야기도  결말도 필요한것같아 좋았다.', '영화 <보이스>를 연상시키는 영화였고, 한국 경찰분들께서 꼭 관람하셨으면 하는 마음이 컸던 영화였어요, 📽🎞🎥', '일요일에 무대인사로 보고왔어요! 개인적으로 오랜만에 극장에서 생각없이 즐기고왔던 영화였던것 같아요! 가벼운 마음으로 보러가기 좋은영화입니다!!', '배우님들 연기가 미쳣네요 ㄷㄷ 캐스팅만으로 사실 기대하고 있었는데 그 이상입니다 꼭 보세요 웃음포인트도 타이밍 좋게 들어오고 구도, 스토리도 탄탄합니다 박수치면서 웃은 영화는 처음', '실화바탕이라는게 놀랍고 라미란의 범죄도시같은 느낌', '라미란의 깜찍 발랄한 범죄 스릴러!!\n보이스 피싱 총책은 내가 잡는다! 영화 보이스와 범죄도시2 시민덕희가 오버랩되는 현상.', '다소 단조롭지만 지루하진 않은 서사 구조, 배우들의 연기가 영화의 부족한 부분을 채운다.', '시사회로 먼저 보고 왔어요! 잔인한 장면에 생각보다 좀 놀라긴 했지만 유쾌하게 풀어가는 배우들의 연기력 또한 놀라웠습니다 재밌어요!', '적절한 유머가 좋았습니다 \n고구마 주의', '더 마블스 부럽지 않은 더 덕희스!😎', '코미디+액션+스릴러 다 가져간 영화입니다! 전개도 시원시원하고 배우들 연기도 구멍이 없어요 재밌습니다~!', '간만에 정말 웃으면서 본 상반기 최고의 영화!', '재밌게 봤어요 라미란 배우 연기 짱..❤️', '가족과 가볍게 즐기면서 볼 수 있는 반가운 영화! 보는 내내 재밌어서 돈이 아깝지 않았다', '보이스피싱이라는 소재를 사용한 영화라 곳곳에 어두울 수 있는 부분들이 많았는데 적절한 유머가 섞여서 꽤나 좋은 시너지를 낸 것 같다.', '보이스피싱범을 상대로 평범한 시민의 통쾌한 복수극\n시간가는줄 모르고 재밌게 봤습니다.', '애써 단점을 찾고 싶지 않은 재밌는 영화 <시민덕희>', '믿고볼수있는 배우들이 나와서 정말 기대가됐던영화.\n역시나 꿀잼이었고 자칫 답답하고 화만 날수 있는 소재에 통쾌&코믹을 적절히 녹여주어서 정말 재밌게 웃으며봤음.', '어디서 많이 봤어.. 봤는데.. 재밌다?', '여자들이 다하는 영화 🫶', '재밌다 ! 가족들과 함께 보면 좋을 영화 🫶🏻\n\n중간 중간 나오는 코믹 요소들이 좋았던,\n그러나 너무 가볍지만은 않은 영화!', '통쾌하고 재밌어요~! 시간 가는 줄 모르고 보게 되는 영화', '무난한 스토리와 이름값하는 연기', '배우분들 연기가 너무 좋았고 실제 이야기 라서 그런지 몰입이 잘 되었어요', '시사회 보고왔는데 너무 재미있었어요 개봉하면 다른 친구들이랑 봐야겠어요!!', '지루할 틈 없이 전개되는 스토리.\n개연성이 부족한 부분이 있지만, 거슬리진 않았음. \n보이스피싱을 소재로 너무 무겁지도, 너무 가볍지도 않은 영화.', '덕희봉림숙자애림 네 여자의 케미로는 어떤 일이든 해낼 수 있을 것 같다.\n\n덕희의 무모하면서도 용기있는 추진력은 꽤나 닮고 싶은 부분. 이러한 덕희의 면모를 알아본 재민에게도 박수', '11일에도 보고 18일에도 봤는데 코믹하고 배우님들 명품연기가 돋보였습니다 실화바탕이라서 더 재밌게봤어요.', '포스터만 보고 흔한 한국 코미디 영화겠거니 했는데, 생각보다 몰입도 강하고 흥미진진해서 놀랐음! 처음부터 끝까지 놓치고 싶은 부분이 없는 영화였다. 웃음과 내용 둘 다 잡은 듯!', '예고편도 안 보고 배우들만 보고 믿고 봤는데 너무 재밌게 봤습니다 중간에 웃음 포인트들도 많아서 웃으면서 봤어요', '초반부 몰입감이 엄청나지만 \n후반부까지 이 몰입감이 끌고 갔으면 더 좋았을 것 같다 그렇지만 무척 즐겁게 즐길 수 있는 영화라 좋았다', '2시간동안 루즈하지 않은 스피드한 전개감이 너무 좋았다.', '킬링타임용으로 재밌게 볼 수 있는 영화. 실화라고 하니 더 몰입이 된다.', '제가 지루한 걸 싫어하는 타입인데 이 영화는 지루할 틈도 없고 너무 재밌어요 영화 나오시는 분들 다 연기 잘하시고 2024년 1월 최고의 영화에요', '생각보다 더 재밌었다!\n말도 안되는 히어로가 아니라 희노애락의 삶에서 충분히 탄생 가능하고, 그래서 납득할 수 있는 히어로 덕희! 즐거운 시간이었음', '2024/01/18시사회에 당첨됨', '시사회로 보고 왔는데 너무 재밌게 보고왔습니다!!', '보이스피싱 수법이 점차 발전하는거에 대해 두려움이 많은데 실화를 바탕으로 수법이나 총책을 잡기까지의 과정이 무겁지 않게 표현되어서 너무 재밌게 봤다', '시사회보고 왔어요. 아버지가 최근 보이스피싱 통화를 하셨어서 남의일이 아닌 정말 가까운 나에게도 일어날 수 있는 문제이고 주제는 가볍지 않지만 웃으며 봤어요. 라미란 염혜란님 최고', '역시 라미란 배우님 믿고 보는 것 같아요.코믹하고 재밌어요!!', '너무 무겁지 않게 웃긴 타이밍엔 확실히 웃기게 잘 풀어낸 이야기🥹😄', '배우들이 연기구멍 없이 모두 연기를 잘해서 보는데 편안했고 재밌었습니다!', '시사회로 보고 온 시민덕희 실화 바탕 내용을 보고 가서 그런지 보이스피싱 피해자가 이렇게까지 해야 하나 싶어서 재밌기도 했지만 맘이 좀 아팠네요', '사회의 문제점들을 비판하며, 도움이 필요한 이들에겐 도움의 손길을, 잘못된 행동을 한 이들에겐 행동에 따른 책임을 지게 해야함을 제시하는 영화라 생각.', '덕분에 재밌게 잘 보았습니다. 보이싱피싱이 얼른 사라지는 그날이 오면 좋겠네요', '역시 믿고 보는 배우들!! 이번에도 너무 재밌게 봤습니다😀 다들 연기도 잘하고 실화 배경이라 그런지 과몰입해서 잘 보고왔습니다.', '덕희덕 쿵더러러러', '보이스 피싱 당한 피해자의 심정은 헤아릴수는 없지만 시민 덕희를 보며 약간의 공감은 할 수 있을거라 생각합니다. 그래도 어느 정도의 속시원함이 있어 재밌게 봤습니다.', '피해자 역할에서 라미란배우님의 연기와 범죄에 연류되는 그곳에서 탈출하고싶어하는 공명 배우님의 연기가 뛰어났어요 그리고 중간중간 웃음 포인트도있어서 재미있게 시사회다녀왔습니다!', '이게 실화기반이라는 것도 엔딩은 그저 픽션이란 것도 커다란 비극 아닐까.', '.', '평범한 일상을 p;ㅠ 만들어버림', '긴박하게 잘 짜여있음. 영화 같은 실화', '팀 덕희, 그들이 피해자이자 승리자이다!', '역시 라미란! 몰입하기 좋은 영화였다', '‘영웅’보다 ‘시민’의 힘이 컸던 이야기.', '믿고 보는 라미란! 염혜란, 장윤주, 안은진과의 케미도 정말 좋았다👍 마음 편하게 즐길 수 있는 영화라 새해 첫 영화로도 강력 추천!', '여자들이 다 하는 영화! 보는 내내 재밌게 본 영화\n우리 사회에 깊게 스며든 보이스 피싱이라는 범죄에 대해 잘 보여주고, 실화를 바탕으로 한만큼 몰입도가 상당해서 좋았음', '결과가 뻔해도 메세지가 주는 울림이 있다. 피해자가 잘못한게 아니라는 것. 오랜만에 본 위안과 웃음을 모두 준 영화', '시사회 갔다왔습니다\n오랜만에 본 영화인데 너무 재미있더라고요\n시간이 있으면 다시 보고 싶어요', '영화 보는 내내 지루하지 않고 긴장하게 했다가 웃게 했다가 들었다놨다하는 영화!\n특히 여자 네분 모였을 때 케미터지고 다들 연기 너무 웃기게 잘하십니당!', '어제 시사회를 통해 미리 봤는데 너무 재밌게봤어요!!!\n기대했던 영화였는데  개봉날 기달려요^^', '역시 믿고 보는 라미란 배우님 작품! \n실패할 수가 없네요 🫶 \n개성있는 캐릭터가 돋보이고, 실화인 만큼 \n여타 범죄영화와 달리 유쾌하고 뭉클한 느낌이네요 ㅠㅠ \n시민덕희 최고!', '키노라이츠 시사 후기.', '키노 덕분에 개봉일보다 빨리 볼 수 있었던 시민덕희! 웃음 포인트도 많고 잔인한…? 폭력적인 장면도 조금 있는데 전체적으로 봤을 땐 괜찮은 영화인 것 같습니다!', '2024 새해에 딱 보기 좋은 주제의 영화인 것 같아 너무 기대됩니다~!!', '사이다 추적극 기대하고 있습니다!!', '실화를 기반으로 만든 논픽션 영화\n안타까운 피해자 덕희, 왜존재하는지 모르겠는 경찰과\n범죄조직에게 속아 감금된채 보이스피싱을 하다 덕희에게 도움을 청하는데 고구마x100']"
